{
  "schema_version": 1,
  "system": "aris-code",
  "provider": "qwen",
  "model": "FILL_MODEL_ID",
  "base_url": "https://dashscope.aliyuncs.com/compatible-mode/v1",
  "api_key_env": "DASHSCOPE_API_KEY",
  "support": "native",
  "adapter": null,
  "reviewer": {"provider": "FILL_FIXED_REVIEWER_PROVIDER", "model": "FILL_FIXED_REVIEWER_MODEL"},
  "execution": {"budget_policy": "no_hard_cap", "record_usage": true, "record_failed_requests": true}
}
